{
  "name": "Neutral",
  "description": "Unbranded base preset for reuse across systems",
  "author": "Craft Design",
  "license": "MIT",
  "supportedModes": ["light", "dark"],
  "shikiTheme": {
    "light": "github-light",
    "dark": "github-dark"
  },
  "background": "#f7f7f8",
  "foreground": "#1f2328",
  "accent": "#2563eb",
  "info": "#d97706",
  "success": "#16a34a",
  "destructive": "#dc2626",
  "dark": {
    "background": "#17181b",
    "foreground": "#f5f5f5",
    "accent": "#60a5fa",
    "info": "#fbbf24",
    "success": "#4ade80",
    "destructive": "#f87171"
  }
}
